18:51:59.098340 IP 0.0.0.0.68 > 255.255.255.255.67: BOOTP/DHCP, Request from 00:e0:4c:43:dd:99, length 300
E..HA.....x..........D.C.4.z....xd)..*....................LC............................................................................................................................................................................................................c.Sc5..7..y...lrw._,.9...=....LC..3..v....Justins-Air-2.........
18:52:02.102804 IP 169.254.72.45.49150 > 255.255.255.255.49150: UDP, length 12
E..(;/.....j..H-............Advatech....
18:52:02.112646 IP 169.254.72.46.49150 > 255.255.255.255.49150: UDP, length 1212
E....@........H.............Advatech............PixLite 16 MkII ECO.............V2.1.1.................H........H.........T .................................................................................	.
........................................... ................................................................................................................................................................................................................................................................................................dddddddddddddddddddddddddddddddd..............*...............................................................................................................................TLS3001....SM16716....WS2801.....LPD6803....WS2811.....WS2812.....WS2812B....MBI6020....TM1803.....TM1804.....TM1809.....MY9221.....MY9231.....APA102.....SK6812.....UCS1903....P9813......SK9822.....DMX512.....UCS2904....UCS9812....WS2813.....SK6822.....UCS8903....TM1814.....MY9291.....GS8208.....WS2815.....UCS8904....WS2814.....APA104.....APA109.....TM1914.....SM16703....SM16704....WS2811v1.4.SK6813.....SM16714....MBI6023....SM16803....SM16804....ICND2110*5U........PDPL1 (12V)...............................#..w.u........
18:52:06.517599 IP 169.254.72.45.49150 > 169.254.72.46.49150: UDP, length 26
E..6J.........H-..H......".MAdvatech..................
18:52:06.520856 IP 169.254.72.46.49150 > 255.255.255.255.49150: UDP, length 30
E..:.A.....E..H..........&.DAdvatech..	.........H.........
18:52:07.249342 IP 0.0.0.0.68 > 255.255.255.255.67: BOOTP/DHCP, Request from 00:e0:4c:43:dd:99, length 300
E..HA.....x..........D.C.4.r....xd)..2....................LC............................................................................................................................................................................................................c.Sc5..7..y...lrw._,.9...=....LC..3..v....Justins-Air-2.........
18:52:13.642889 IP 169.254.72.45.49150 > 169.254.72.46.49150: UDP, length 26
E..6......'...H-..H......".MAdvatech..................
18:52:13.647920 IP 169.254.72.46.49150 > 255.255.255.255.49150: UDP, length 30
E..:.B.....D..H..........&.DAdvatech..	.........H.........
18:52:14.433689 IP 169.254.72.45.49150 > 169.254.72.46.49150: UDP, length 539
E..7......M...H-..H......#..Advatech.............H.........................................................................................	.
........................................... ................................................................................................................................................................................................................................................................................................dddddddddddddddddddddddddddddddd....................PDPL1 (12V).............................#
18:52:14.434344 IP 169.254.72.46 > 224.0.0.2: igmp leave 239.255.0.1
F.. .C....Rf..H...............................
18:52:14.434472 IP 169.254.72.46 > 224.0.0.2: igmp leave 239.255.0.2
F.. .D....Re..H...............................
18:52:14.434473 IP 169.254.72.46 > 224.0.0.2: igmp leave 239.255.0.3
F.. .E....Rd..H...............................
18:52:14.434474 IP 169.254.72.46 > 224.0.0.2: igmp leave 239.255.0.4
F.. .F....Rc..H...............................
18:52:14.434632 IP 169.254.72.46 > 224.0.0.2: igmp leave 239.255.0.5
F.. .G....Rb..H...............................
18:52:14.434634 IP 169.254.72.46 > 224.0.0.2: igmp leave 239.255.0.6
F.. .H....Ra..H...............................
18:52:14.434635 IP 169.254.72.46 > 224.0.0.2: igmp leave 239.255.0.7
F.. .I....R`..H...............................
18:52:14.434805 IP 169.254.72.46 > 224.0.0.2: igmp leave 239.255.0.8
F.. .J....R_..H...............................
18:52:14.434806 IP 169.254.72.46 > 224.0.0.2: igmp leave 239.255.0.9
F.. .K....R^..H................	..............
18:52:14.434836 IP 169.254.72.46 > 224.0.0.2: igmp leave 239.255.0.10
F.. .L....R]..H................
..............
18:52:14.434914 IP 169.254.72.46 > 224.0.0.2: igmp leave 239.255.0.11
F.. .M....R\..H...............................
18:52:14.434916 IP 169.254.72.46 > 224.0.0.2: igmp leave 239.255.0.12
F.. .N....R[..H...............................
18:52:14.437478 IP 169.254.72.46 > 224.0.0.2: igmp leave 239.255.0.13
F.. .O....RZ..H...............................
18:52:14.442636 IP 169.254.72.46 > 224.0.0.2: igmp leave 239.255.0.14
F.. .P....RY..H...............................
18:52:14.442637 IP 169.254.72.46 > 224.0.0.2: igmp leave 239.255.0.15
F.. .Q....RX..H...............................
18:52:14.442638 IP 169.254.72.46 > 224.0.0.2: igmp leave 239.255.0.16
F.. .R....RW..H...............................
18:52:14.442798 IP 169.254.72.46 > 224.0.0.2: igmp leave 239.255.0.17
F.. .S....RV..H...............................
18:52:14.442800 IP 169.254.72.46 > 224.0.0.2: igmp leave 239.255.0.18
F.. .T....RU..H...............................
18:52:14.442971 IP 169.254.72.46 > 224.0.0.2: igmp leave 239.255.0.19
F.. .U....RT..H...............................
18:52:14.442972 IP 169.254.72.46 > 224.0.0.2: igmp leave 239.255.0.20
F.. .V....RS..H...............................
18:52:14.442973 IP 169.254.72.46 > 224.0.0.2: igmp leave 239.255.0.21
F.. .W....RR..H...............................
18:52:14.443131 IP 169.254.72.46 > 224.0.0.2: igmp leave 239.255.0.22
F.. .X....RQ..H...............................
18:52:14.443240 IP 169.254.72.46 > 224.0.0.2: igmp leave 239.255.0.23
F.. .Y....RP..H...............................
18:52:14.443241 IP 169.254.72.46 > 224.0.0.2: igmp leave 239.255.0.24
F.. .Z....RO..H...............................
18:52:14.443300 IP 169.254.72.46 > 224.0.0.2: igmp leave 239.255.0.25
F.. .[....RN..H...............................
18:52:14.443566 IP 169.254.72.46 > 224.0.0.2: igmp leave 239.255.0.26
F.. .\....RM..H...............................
18:52:14.443567 IP 169.254.72.46 > 224.0.0.2: igmp leave 239.255.0.27
F.. .]....RL..H...............................
18:52:14.443617 IP 169.254.72.46 > 224.0.0.2: igmp leave 239.255.0.28
F.. .^....RK..H...............................
18:52:14.443700 IP 169.254.72.46 > 224.0.0.2: igmp leave 239.255.0.29
F.. ._....RJ..H...............................
18:52:14.443701 IP 169.254.72.46 > 224.0.0.2: igmp leave 239.255.0.30
F.. .`....RI..H...............................
18:52:14.443701 IP 169.254.72.46 > 224.0.0.2: igmp leave 239.255.0.31
F.. .a....RH..H...............................
18:52:14.443840 IP 169.254.72.46 > 224.0.0.2: igmp leave 239.255.0.32
F.. .b....RG..H................ ..............
18:52:14.643641 IP 169.254.72.45.49150 > 255.255.255.255.49150: UDP, length 12
E..(......>k..H-............Advatech....

